,id,date,rawContent,cleaned_content,english_relative_frequency
26,27,2022-01-01 23:35:31+00:00,@ekky____ Hbo go bang ek,hbo go bang ek,0.75
85,186,2022-01-03 23:09:34+00:00,This week will continue testnet for NFT presale .. stay tune #salmonation #salmonchain #blockchain #crypto,this week will continue testnet for nft presale stay tune,0.7
17,218,2022-01-04 23:34:27+00:00,"Top Apache projects in 2021: From Superset, to NuttX

https://t.co/aZJoU2r89r",top apache projects in 2021 from superset to nuttx,0.75
42,243,2022-01-04 23:03:15+00:00,"China's Covid-19 lockdown in Xi'an hits chipmakers Samsung, Micron

https://t.co/huypeRdMru",chinas covid 19 lockdown in xian hits chipmakers samsung micron,0.7777777777777778
72,273,2022-01-04 22:27:23+00:00,Isa pa to ni Lee Pyo sa Moonshine eh hahahahaha,isa pa to ni lee pyo sa moonshine eh hahahahaha,0.7
40,341,2022-01-05 23:36:28+00:00,@yakimasuu @Whisi Er ignoriert mich seit 2020,er ignoriert mich seit 2020,0.75
47,348,2022-01-05 23:27:58+00:00,Just posted a photo @ Tasek Bandar Seri Alam https://t.co/a6cUYUHzC0,just posted a photo tasek bandar seri alam,0.75
20,521,2022-01-07 23:26:29+00:00,"Di mana ada tragedi,di situ ada panda atau grab..",di mana ada tragedidi situ ada panda atau grab,0.7777777777777778
48,549,2022-01-07 22:17:41+00:00,People need to start showering in the morning!!! BUSOKKKKKK,people need to start showering in the morning busokkkkkk,0.7777777777777778
61,562,2022-01-07 21:35:33+00:00,I'm at Masjid Jamek Kg Ulu Pulai https://t.co/OFVhHw1VOR,im at masjid jamek kg ulu pulai,0.7142857142857143
85,586,2022-01-07 19:43:20+00:00,Wtf I'm going NCID,wtf im going ncid,0.75
24,625,2022-01-08 23:26:09+00:00,Yey month of December ang puli ko..sakto gid..maka spend Christmas.,yey month of december ang puli ko sakto gid maka spend christmas,0.75
60,661,2022-01-08 21:43:20+00:00,"AYYYOOOOOO !! You look like you need some Swavycustoms SO TAPN and LETS GET IT GOING!!!! 😈😈😈😈🤞🏽🤞🏽
#SWAVY @ Krusty Krab - Bikini Bottom https://t.co/BtkqaVg0VL",ayyyoooooo you look like you need some swavycustoms so tapn and lets get it going krusty krab bikini bottom,0.7368421052631579
1,702,2022-01-09 23:57:57+00:00,"Search ✍ typing ""chelsea transfer"". Since 011221 until 100122. Everything that pops up merely the rumours
 or chelsea players end contract 😞",search typing chelsea transfer since 011221 until 100122 everythingthatpops upmerelythe rumours or chelsea players end contract,0.7142857142857143
10,711,2022-01-09 23:50:01+00:00,"Yung paghindi pag harmonize ni ken, ni pablo at stell pag line na ni jah at josh. Palatandaan yun na nag improve at level up na vocals nilang dlawa at di na need ng gabay nung tatlo.

@SB19Official #SB19
#Bazinga_SB19",yung paghindi pag harmonize ni ken ni pablo at stell pag line na ni jah at josh palatandaan yun na nag improve at level up na vocals nilang dlawa at di na need ng gabay nung tatlo,0.7567567567567568
41,742,2022-01-09 22:51:44+00:00,@BTS_twt @kookpiics I love u Jungkook 🖤🖤 https://t.co/dy12dD22Ek,i love u jungkook,0.75
91,792,2022-01-09 20:15:11+00:00,Pea Pod Tips (Dou Miao) @ Dian Xiao Er Northpoint City https://t.co/07bLJO3uOe,pea pod tips dou miao dian xiao er northpoint city,0.7
93,794,2022-01-09 20:13:33+00:00,Broccoli with Scallops @ Dian Xiao Er Northpoint City https://t.co/vkx3XiPdsh,broccoli with scallops dian xiao er northpoint city,0.75
94,795,2022-01-09 20:12:58+00:00,E-fu Noodle with Conpoy and Golden Mushrooms @ Dian Xiao Er Northpoint City https://t.co/PplLRSYVr9,e fu noodle with conpoy and golden mushrooms dian xiao er northpoint city,0.7692307692307693
27,828,2022-01-10 23:28:16+00:00,Just posted a photo @ Shangri-La Rasa Sentosa Singapore https://t.co/UBJwsIWHv6,just posted a photo shangri la rasa sentosa singapore,0.7777777777777778
40,841,2022-01-10 23:14:45+00:00,Okay… These look like cute badasses. @teddybearsclub_ LFG. @visual_inc @thankgodimhaziq @iamheenja,okay these look like cute badasses lfg,0.7142857142857143
58,859,2022-01-10 22:43:13+00:00,Good morning..kaya PABA?,good morning kaya paba,0.75
22,923,2022-01-11 23:40:13+00:00,Just posted a photo @ Johor FM Permata Selatan https://t.co/1U56LqCXek,just posted a photo johor fm permata selatan,0.75
25,926,2022-01-11 23:38:33+00:00,Just posted a photo @ Johor FM Permata Selatan https://t.co/4QsDpOPyoV,just posted a photo johor fm permata selatan,0.75
29,930,2022-01-11 23:37:07+00:00,Just posted a photo @ Johor FM Permata Selatan https://t.co/WHGeVrqZhb,just posted a photo johor fm permata selatan,0.75
33,934,2022-01-11 23:35:35+00:00,@adiefahmy I saw your tweet. Hmmm saya cepat panic. So mmg refer Id then terus pakar. Hope just alergic ubat je lh,i saw your tweet hmmm saya cepat panic so mmg refer id then terus pakar hope just alergic ubat je lh,0.7142857142857143
34,935,2022-01-11 23:35:34+00:00,Just posted a photo @ Johor FM Permata Selatan https://t.co/rTebLXHDqB,just posted a photo johor fm permata selatan,0.75
37,938,2022-01-11 23:34:24+00:00,Just posted a photo @ Johor FM Permata Selatan https://t.co/axa42GE2JG,just posted a photo johor fm permata selatan,0.75
38,939,2022-01-11 23:33:19+00:00,Just posted a photo @ Johor FM Permata Selatan https://t.co/yxZzgSfN5W,just posted a photo johor fm permata selatan,0.75
39,940,2022-01-11 23:32:33+00:00,Just posted a photo @ Johor FM Permata Selatan https://t.co/hDhI48iFyi,just posted a photo johor fm permata selatan,0.75
41,942,2022-01-11 23:31:50+00:00,Just posted a photo @ Johor FM Permata Selatan https://t.co/6awDI4ZFlA,just posted a photo johor fm permata selatan,0.75
42,943,2022-01-11 23:31:15+00:00,Just posted a photo @ Johor FM Permata Selatan https://t.co/735U0AMKeA,just posted a photo johor fm permata selatan,0.75
49,950,2022-01-11 23:29:22+00:00,Just posted a photo @ Johor FM Permata Selatan https://t.co/riQ69e5YKy,just posted a photo johor fm permata selatan,0.75
58,959,2022-01-11 23:26:41+00:00,✨Live exploring 2.4 and enkonomiya https://t.co/9r2yd5bVeN,live exploring 2 4 and enkonomiya,0.75
59,960,2022-01-11 23:25:50+00:00,Just posted a photo @ Johor FM Permata Selatan https://t.co/mTmzYrwLZ1,just posted a photo johor fm permata selatan,0.75
84,985,2022-01-11 22:44:32+00:00,Natulogan gid ko last night hahaha sa kakapoy bah..,natulogan gid ko last night hahaha sa kakapoy bah,0.7777777777777778
91,992,2022-01-11 22:34:30+00:00,"If left to Perhilitan, there won't any Malayan tigers left! Or any of our big cats!!! Case of harapkan pagar, pagar makan padi. https://t.co/6Iyok45afH",if left to perhilitan there wont any malayan tigers left or any of our big cats case of harapkan pagar pagar makan padi,0.7391304347826086
93,994,2022-01-11 22:30:55+00:00,Wow this PCR test at Changi quite exciting,wow this pcr test at changi quite exciting,0.75
0,1001,2022-01-12 23:58:06+00:00,Whats with my bf’s twt likes man YUCK,whats with my bfs twt likes man yuck,0.75
19,1020,2022-01-12 23:25:03+00:00,Thank you admin..isa ka sa mga marytupok na keepers😂,thank you admin isa ka sa mga marytupok na keepers,0.7
51,1052,2022-01-12 22:48:13+00:00,"@priyaram14 Thanks, EllP. I am always bugging you. Ha ha. 😅",thanks ellp i am always bugging you ha ha,0.7777777777777778
57,1058,2022-01-12 22:45:02+00:00,@superjanc Damu2 na ko nadownload pero got no time to watch pa. Pero by the end of the month cguro pa europe na kmi so maybe that time na ko makawatch.,damu2 na ko nadownload pero got no time to watch pa pero by the end of the month cguro pa europe na kmi so maybe that time na ko makawatch,0.7931034482758621
52,1153,2022-01-13 23:12:58+00:00,"Good morning hahaah. 

BAZINGA MAINSTAY BBHTS
@SB19Official #SB19

#Bazinga_SB19 is my hype song!",good morning hahaah bazinga mainstay bbhts is my hype song,0.7
62,1163,2022-01-13 22:57:59+00:00,@thetimes Freedom liberté pour toi!,freedom liberté pour toi,0.75
46,1247,2022-01-14 23:02:38+00:00,Shazamを使ってコールドプレイのHymn For The Weekendを発見しました。 https://t.co/ersw3gYdo1,shazamhymn for the weekend,0.75
99,1300,2022-01-14 20:55:56+00:00,@KellyHu Be safe Kelly.tkc,be safe kelly tkc,0.75
12,1313,2022-01-15 23:39:44+00:00,Thank you lord sa lahat lahat ng blessings mo po samin.. Good health lang po para sa hga mahal ko sa buhay..ilayo mo po sila sa kpahamakan..amen. https://t.co/NUZ21xg9ik,thank you lord sa lahat lahat ng blessings mo po samin good health lang po para sa hga mahal ko sa buhay ilayo mo po sila sa kpahamakan amen,0.7241379310344828
17,1318,2022-01-15 23:35:49+00:00,Payat ko pai hahaha https://t.co/38bvu1rvw5,payat ko pai hahaha,0.75
53,1354,2022-01-15 22:22:30+00:00,"Page 16 of 365

Hi there...
Im still here...
Like before...
But,ill use anothers atittude now.",page 16 of 365 hi there im still here like before butill use anothers atittude now,0.7857142857142857
99,1400,2022-01-15 19:34:57+00:00,Nonya Avocado Bua Kuluak Fried Rice delivered by @tabaojiak #tabaojiak @ Chilli Padi Nonya Restaurant https://t.co/hYSlUVSQB1,nonya avocado bua kuluak fried rice delivered by chilli padi nonya restaurant,0.75
60,1461,2022-01-16 22:47:41+00:00,Bte. I go school,bte i go school,0.75
1,1502,2022-01-17 23:56:10+00:00,I'm at Blk 210 Choa Chu Kang Central https://t.co/nvqlF7DV8o,im at blk 210 choa chu kang central,0.7142857142857143
52,1553,2022-01-17 23:23:43+00:00,@mami_sisca69 Mau dong wa nya,mau dong wa nya,0.75
67,1568,2022-01-17 23:05:56+00:00,"Just posted a photo @ Pasir Gudang, Johor, Malaysia https://t.co/rXky3ksqwh",just posted a photo pasir gudang johor malaysia,0.75
61,1662,2022-01-18 22:57:36+00:00,Check out MalaysiaFood&amp;Travel's video! #TikTok https://t.co/dyuuJ40oME,check out malaysiafoodandtravels video,0.75
75,1676,2022-01-18 22:42:29+00:00,Check out klitoris's video! #TikTok https://t.co/HZqPR5O0uC,check out klitoriss video,0.75
98,1699,2022-01-18 21:43:42+00:00,"Oh my!! I thinking about something else!!! Damn!! Namjoon, i can bark 😅. Worf worf",oh my i thinking about something else damn namjoon i can bark worf worf,0.7857142857142857
27,1728,2022-01-19 23:21:36+00:00,@chenletonin Haechan punching air rn,haechan punching air rn,0.75
70,1771,2022-01-19 22:37:42+00:00,@fahmitsu Used Zhongli + Keqing ( I only use her to do platforming stuff 😅),used zhongli keqing i only use her to do platforming stuff,0.7272727272727273
95,1796,2022-01-19 21:43:43+00:00,Harry maguire marking fred. Thanks for losing me some fpl pts you fridgehead dog,harry maguire marking fred thanks for losing me some fpl pts you fridgehead dog,0.7857142857142857
30,1831,2022-01-20 23:38:41+00:00,What if pag Bugtaw ko sa pinas na ko..😁 haysss I miss home! https://t.co/xGNUCc0Tzh,what if pag bugtaw ko sa pinas na ko haysss i miss home,0.7692307692307693
35,1836,2022-01-20 23:33:06+00:00,@Bloodu999 Paatala books tappa regular books kastame ee count,paatala books tappa regular books kastame ee count,0.75
43,1844,2022-01-20 23:28:54+00:00,"Guys enjoy niyo lang...! 

BAZINGA 4M VIEWS
@SB19Official #SB19
#SB19Bazinga4MViews 

Stream #Bazinga_SB19",guys enjoy niyo lang bazinga 4m views stream,0.7142857142857143
49,1850,2022-01-20 23:23:42+00:00,"Try to listen BAZINGA while tweeting. U can feel your thumb kicking ahahhaa

BAZINGA 4M VIEWS
@SB19Official #SB19
#SB19Bazinga4MViews 

Stream #Bazinga_SB19",try to listen bazinga while tweeting u can feel your thumb kicking ahahhaa bazinga 4m views stream,0.75
68,1869,2022-01-20 23:13:50+00:00,"This our boys legacy!

BAZINGA ON BBHTS
@SB19Official #SB19

Listen to #Bazinga_SB19",this our boys legacy bazinga on bbhts listen to,0.7777777777777778
76,1877,2022-01-20 23:10:58+00:00,"Mas maganda pa din yung CLASSY  at Quality tweets nababasa under our tags kesa HATE tweets.

BAZINGA ON BBHTS
@SB19Official #SB19

Listen to #Bazinga_SB19",mas maganda pa din yung classy at quality tweets nababasa under our tags kesa hate tweets bazinga on bbhts listen to,0.7619047619047619
1,1902,2022-01-21 23:55:39+00:00,"@luvsbozo No wake up smelly, wake up,wake up,wake up 🖕🖕🖕",no wake up smelly wake upwake upwake up,0.75
29,2130,2022-01-23 23:31:42+00:00,Just posted a photo @ Angsana Johor Bahru Mall https://t.co/1kc8ZkqQJ8,just posted a photo angsana johor bahru mall,0.75
98,2199,2022-01-23 21:55:10+00:00,"@dhiasyaf_ @Ashsukamakan Boleh cuba Samsung S21 Ultra, sample moon shot  100x zoom ada di media saya ✌️. Sangat2 puas hati sumpah x tipu",boleh cuba samsung s21 ultra sample moon shot 100x zoom ada di media saya sangat2 puas hati sumpah x tipu,0.7647058823529411
8,2209,2022-01-24 23:53:21+00:00,"@tibytinneh True.

Still, headpats only. https://t.co/6OKQd2GfSK",true still headpats only,0.75
22,2223,2022-01-24 23:34:59+00:00,"Its a day. Haihhh nervous sia nk tahu result 😩😩. Kadang mulut aku ni masin, kalau aku ckp A, result dia pun A. Tp aku harap tak lah. Hmmmmm hope semua ye okay. 💪🏼💪🏼",its a day haihhh nervous sia nk tahu result kadang mulut aku ni masin kalau aku ckp a result dia pun a tp aku harap tak lah hmmmmm hope semua ye okay,0.71875
22,2323,2022-01-25 23:46:38+00:00,I'm at Blk 210 Choa Chu Kang Central https://t.co/5bldXB5zBd,im at blk 210 choa chu kang central,0.7142857142857143
24,2325,2022-01-25 23:42:40+00:00,"Brasil é a terra do ""se nada der certo, eu viro...""",brasil é a terra do se nada der certo eu viro,0.7272727272727273
46,2347,2022-01-25 23:22:38+00:00,"Baka yung ""BREAK RECORD"" sa mga headlines bigdeal na nman po sa kanila😭

BAZINGA 7HIS IS MY LEGACY
@SB19Official #SB19
#SB19LeadsBillboardHTS

Listen to #Bazinga_SB19",baka yung break record sa mga headlines bigdeal na nman po sa kanila bazinga 7his is my legacy listen to,0.7368421052631579
97,2398,2022-01-25 21:50:31+00:00,"Ou melhor, o venezuelano...",ou melhor o venezuelano,0.75
42,2443,2022-01-26 23:22:46+00:00,Poor mindset yung di kay maka mind your own business ateee..ang aga mong manira ng araw,poor mindset yung di kay maka mind your own business ateee ang aga mong manira ng araw,0.7647058823529411
63,2464,2022-01-26 22:55:07+00:00,Damu pretty sa young generations... Puro nga lang ka artehan.🐙,damu pretty sa young generations puro nga lang ka artehan,0.7
87,2488,2022-01-26 22:20:38+00:00,With Singapore actress Cynthia Koh @ Singapore / Singapura / 新加坡 / சிங்கப்பூர் https://t.co/ogQCERvO3Q,with singapore actress cynthia koh singapore singapura,0.7142857142857143
4,2505,2022-01-27 23:55:32+00:00,Centrepoint kids are legends,centrepoint kids are legends,0.75
14,2515,2022-01-27 23:50:48+00:00,"27 de enero de 1945.
Liberación de Auschwitz por el Ejército Rojo. https://t.co/veUp4ZGXh0 en Auschwitz Concentration Camp https://t.co/Hq61wnqpgj",27 de enero de 1945 liberación de auschwitz por el ejército rojo en auschwitz concentration camp,0.7142857142857143
32,2533,2022-01-27 23:24:32+00:00,I'm at Blk 210 Choa Chu Kang Central https://t.co/VubC6sTmTm,im at blk 210 choa chu kang central,0.7142857142857143
36,2537,2022-01-27 23:21:13+00:00,"I'm at 早到熟食 Zao Dao Shou Shi in Singapore, Kallang https://t.co/A84Pa2tScX https://t.co/ua9sNdchf6",im at zao dao shou shi in singapore kallang,0.7777777777777778
75,2576,2022-01-27 22:18:21+00:00,@YouTube @marionskitchen 's XO sauce recipe,s xo sauce recipe,0.75
18,2619,2022-01-28 23:47:45+00:00,HOLY SHIT HAS QUACKITY STREAMED UET?! I DON'T WNNA MISS IT,holy shit has quackity streamed uet i dont wnna miss it,0.7272727272727273
19,2620,2022-01-28 23:46:05+00:00,"Just posted a photo @ Gelang Patah, Johor, Malaysia https://t.co/xg9A9xf5vI",just posted a photo gelang patah johor malaysia,0.75
26,2627,2022-01-28 23:41:40+00:00,huhhh oh no get well soon yubin😭,huhhh oh no get well soon yubin,0.7142857142857143
37,2638,2022-01-28 23:36:01+00:00,@aliantshaaaaa1 nama siapa lah tu,nama siapa lah tu,0.75
56,2657,2022-01-28 23:27:53+00:00,Tani okay na mama ko bah..ayo na sa trangkaso. 😌,tani okay na mama ko bah ayo na sa trangkaso,0.7
62,2663,2022-01-28 23:26:13+00:00,The universe will keep sending you lessons until you finally learn them. Yung saktan ka ng saktan para wala ka nang choice.bangon tapos laban ulit!,the universe will keep sending you lessons until you finally learn them yung saktan ka ng saktan para wala ka nang choice bangon tapos laban ulit,0.7307692307692307
80,2681,2022-01-28 23:08:47+00:00,@Dhichkyaaon Yes by epic propotions 🤣🤣🤣,yes by epic propotions,0.75
83,2684,2022-01-28 23:06:45+00:00,Alay ang booster bah..,alay ang booster bah,0.75
87,2688,2022-01-28 23:02:51+00:00,Good Morning @ Fairmont Singapore https://t.co/hPhVmMLAmg,good morning fairmont singapore,0.75
91,2692,2022-01-28 22:56:20+00:00,Bf with bff (@ Beach Road Prawn Mee Eating House in Singapore) https://t.co/7049qqU6ii,bf with bff beach road prawn mee eating house in singapore,0.7272727272727273
99,2700,2022-01-28 22:44:31+00:00,@food_blogger Famous kkm in Bukit Panjang that is a supper spot. Operates from 4am - 2:30pm.... https://t.co/dDthJBq7rN,famous kkm in bukit panjang that is a supper spot operates from 4am 230pm,0.75
7,2708,2022-01-29 23:44:12+00:00,Just posted a photo @ Tuas Link MRT Station https://t.co/3hWWzvk3MO,just posted a photo tuas link mrt station,0.75
53,2754,2022-01-29 22:12:08+00:00,@raphaelj9s Das ist halt immer die Frage. Würde mich mal interessieren wie die Quote ist.,das ist halt immer die frage würde mich mal interessieren wie die quote ist,0.7142857142857143
87,2888,2022-01-30 22:31:32+00:00,Collection of fishballs (@ 新路 Fishball Noodle in Singapore) https://t.co/A5mlpjW8AF,collection of fishballs fishball noodle in singapore,0.7142857142857143
11,2912,2022-01-31 23:47:14+00:00,Gong xi fa cai! https://t.co/QhYXgz0Dkx,gong xi fa cai,0.75
17,2918,2022-01-31 23:38:21+00:00,Anhon ko ang hong bao ko man? E save or ibakal shoes?😁,anhon ko ang hong bao ko man e save or ibakal shoes,0.75
19,2920,2022-01-31 23:36:39+00:00,"Evening walk with nenek,makcu &amp; the kids.
#hishamkinafamily #tiycjb @ Johor Bahru https://t.co/lWGcPN8gYP",evening walk with nenekmakcu and the kids johor bahru,0.7777777777777778
51,2952,2022-01-31 22:55:42+00:00,Gong Xi Fa Cai!!,gong xi fa cai,0.75
55,3056,2022-02-01 23:00:28+00:00,"Bet ko yata mag breakfast. 

Cheat muna tayo sa IF. 🤭",bet ko yata mag breakfast cheat muna tayo sa if,0.7
60,3061,2022-02-01 22:58:01+00:00,"educate~develop~growth

*Peace upon you..*

📞📞📞
https://t.co/RdpPc3yZmK https://t.co/j5lY9mOLlL",educatedevelopgrowth peace upon you,0.75
78,3079,2022-02-01 22:48:20+00:00,@ninocipri Thank you qnd congrats for Defekt as well!,thank you qnd congrats for defekt as well,0.75
23,3124,2022-02-02 23:37:22+00:00,@sakuraiyui_7 Good Morning Princess Yui ☀️,good morning princess yui,0.75
29,3130,2022-02-02 23:31:45+00:00,"I'm at Oasis Primary School in Damai, Punggol https://t.co/ZgdbFITz5x",im at oasis primary school in damai punggol,0.75
31,3132,2022-02-02 23:27:55+00:00,6/8 pala yung kahapon. So tapos na today ang 7/8.,68 pala yung kahapon so tapos na today ang 78,0.75
78,3179,2022-02-02 22:06:01+00:00,"bros, i need ideas for youtube, drop some if you got some ❤️ that’s pulau ubin, looking smexy #twitchfreejidion  #Help https://t.co/s3hPFchCqw",bros i need ideas for youtube drop some if you got some thats pulau ubin looking smexy,0.7647058823529411
18,3219,2022-02-03 23:52:50+00:00,Poison my new vezel 2021 #vezel2021 #newvezel https://t.co/dHGEIiE6WT,poison my new vezel 2021,0.75
97,3298,2022-02-03 22:17:32+00:00,Aga naman...good morning!,aga naman good morning,0.75
2,3303,2022-02-04 23:55:32+00:00,@aira_bansil C cj wlyen yn,c cj wlyen yn,0.75
7,3308,2022-02-04 23:52:23+00:00,@AzharEzzaira @4rshrf jb kat mana tu,jb kat mana tu,0.75
66,3367,2022-02-04 22:56:22+00:00,Middlesbrough goal actually not counted also knn,middlesbrough goal actually not counted also knn,0.7142857142857143
74,3375,2022-02-04 22:50:46+00:00,Natuyo ko sang ubra ni maria ah hahaha. 3 o clock ata to..abi ko hubog..😂,natuyo ko sang ubra ni maria ah hahaha 3 o clock ata to abi ko hubog,0.7333333333333333
77,3378,2022-02-04 22:48:29+00:00,"@dragonspleen Rooting for you, Elana! ❤️",rooting for you elana,0.75
17,3418,2022-02-05 23:40:14+00:00,"Hahah american/indian warrior/hunter means. Pains shape me to be a warrior/hunter
Peony flowers sa taas. For the love of nature.🤩🤗 
Pa book naman ta. Idol ning artist ko.buot na,humble pa. https://t.co/SK2F2JIQOR",hahah americanindian warriorhunter means pains shape me to be a warriorhunter peony flowers sa taas for the love of nature pa book naman ta idol ning artist ko buot nahumble pa,0.7419354838709677
21,3422,2022-02-05 23:35:52+00:00,"NFTs &amp; Metaverse, anything virtual, including wedding &amp; attendees: https://t.co/iRhiBJ7UPT",nfts and metaverse anything virtual including wedding and attendees,0.7777777777777778
48,3449,2022-02-05 23:01:53+00:00,"Bakit di kapa nagjojowa?
me: financially unstable,mentally unstable,trust issues, overthinking and anxiety. D pa heal totally. Baka d na nga..forever and ever..amen🤣 https://t.co/1jbVTuifB1",bakit di kapa nagjojowa me financially unstablementally unstabletrust issues overthinking and anxiety d pa heal totally baka d na nga forever and ever amen,0.7916666666666666
51,3452,2022-02-05 22:58:36+00:00,Ipunan ko pa ang ink ko pra ma fullsleeve nagid ning Arm ko. How about July? Schedule ko na mapadla savings ahoooy,ipunan ko pa ang ink ko pra ma fullsleeve nagid ning arm ko how about july schedule ko na mapadla savings ahoooy,0.7272727272727273
55,3456,2022-02-05 22:55:25+00:00,Basta drinker ka...pati shirt mo ga cooperate hahha https://t.co/5IP491h3nw,basta drinker ka pati shirt mo ga cooperate hahha,0.7777777777777778
70,3471,2022-02-05 22:30:13+00:00,Bercakap itu adalah satu doa. This places i wish to go. I never stop asking for it. Let divine provisions and time determine everything. InshaAllah. Amin amin ya rabbal al’aminn,bercakap itu adalah satu doa this places i wish to go i never stop asking for it let divine provisions and time determine everything inshaallah amin amin ya rabbal alaminn,0.7333333333333333
79,3480,2022-02-05 22:16:21+00:00,2) Al-Masjid an-Nabawi.,2 al masjid an nabawi,0.75
93,3494,2022-02-05 21:58:52+00:00,"Inna lillahi wa inna ilaihi raji'un. May #rayan be placed with those who believe &amp; showered with grace on his soul. Al-fatihah. Allahumma-ghfir lahu warhamhu wa ‘afihi wa’fu ‘an. Deepest condolences, may Allah give highest patient to his family during this difficult time. Amin 😭",inna lillahi wa inna ilaihi rajiun may be placed with those who believe and showered with grace on his soul al fatihah allahumma ghfir lahu warhamhu wa afihi wafu an deepest condolences may allah give highest patient to his family during this difficult time amin,0.7777777777777778
53,3554,2022-02-06 23:15:53+00:00,"I'm at Oasis Primary School in Damai, Punggol https://t.co/ZyrOwjypkd",im at oasis primary school in damai punggol,0.75
88,3589,2022-02-06 21:16:59+00:00,fuck hbl imma sleep now so goodnitee ✌️,fuck hbl imma sleep now so goodnitee,0.7142857142857143
16,3717,2022-02-08 23:35:20+00:00,Just posted a photo @ Johor FM Permata Selatan https://t.co/WlUiFFVE7x,just posted a photo johor fm permata selatan,0.75
17,3718,2022-02-08 23:33:41+00:00,Just posted a photo @ Johor FM Permata Selatan https://t.co/RWybzvEHx3,just posted a photo johor fm permata selatan,0.75
20,3721,2022-02-08 23:32:36+00:00,Just posted a photo @ Johor FM Permata Selatan https://t.co/8fBZYn3LmZ,just posted a photo johor fm permata selatan,0.75
23,3724,2022-02-08 23:31:45+00:00,Just posted a photo @ Johor FM Permata Selatan https://t.co/DiCZWVpxOh,just posted a photo johor fm permata selatan,0.75
27,3728,2022-02-08 23:31:07+00:00,Just posted a photo @ Johor FM Permata Selatan https://t.co/2bWNEphw7D,just posted a photo johor fm permata selatan,0.75
28,3729,2022-02-08 23:30:23+00:00,Just posted a photo @ Johor FM Permata Selatan https://t.co/uHZRuWCIII,just posted a photo johor fm permata selatan,0.75
33,3734,2022-02-08 23:27:50+00:00,Just posted a photo @ Johor FM Permata Selatan https://t.co/OuXn8s4jHy,just posted a photo johor fm permata selatan,0.75
34,3735,2022-02-08 23:27:09+00:00,Just posted a photo @ Johor FM Permata Selatan https://t.co/gb0YO5mxz9,just posted a photo johor fm permata selatan,0.75
38,3739,2022-02-08 23:26:25+00:00,Just posted a photo @ Johor FM Permata Selatan https://t.co/5JQZuZGdRP,just posted a photo johor fm permata selatan,0.75
45,3746,2022-02-08 23:23:20+00:00,Just posted a photo @ Johor FM Permata Selatan https://t.co/woYi9HVpc9,just posted a photo johor fm permata selatan,0.75
1,3802,2022-02-09 23:57:29+00:00,@PelicansNBA Sad for dame lillard,sad for dame lillard,0.75
3,3804,2022-02-09 23:56:51+00:00,I'm at Blk 210 Choa Chu Kang Central https://t.co/uRjRmNQvR5,im at blk 210 choa chu kang central,0.7142857142857143
19,3920,2022-02-10 23:41:41+00:00,questioning myself again pucha!,questioning myself again pucha,0.75
24,3925,2022-02-10 23:39:39+00:00,"Salam Jumaat...
I'm wearing @tuan_tengkukery ✌️ https://t.co/GwYHOeGyMC",salam jumaat im wearing,0.75
29,3930,2022-02-10 23:33:59+00:00,Interesting new NFT project inam@starting to dig deeper into https://t.co/dPvIDNl6QU @CelestEntities #WAGMI @allnick @nftwriter @ParinHeidari https://t.co/xJQ2V0zw8C,interesting new nft project inam to dig deeper into,0.7777777777777778
59,3960,2022-02-10 23:01:00+00:00,Ambilis..February na..tapos so on and so forth,ambilis february na tapos so on and so forth,0.7777777777777778
84,3985,2022-02-10 22:27:28+00:00,@thebernize10 Ano pa nga ba expect natin? Hahahahaha,ano pa nga ba expect natin hahahahaha,0.7142857142857143
60,4061,2022-02-11 22:33:26+00:00,Miglamig bah..bisan ang heater di mag talab sa tubig,miglamig bah bisan ang heater di mag talab sa tubig,0.7
80,4081,2022-02-11 21:49:44+00:00,@riseartistsph Naka 2.3m na po kayo..@AljonMendoza_  @MissKareee https://t.co/H3Wb3HcbZB,naka 2 3m na po kayo,0.75
